{
  "schema_version": 1,
  "run_id": "real-moon-disappear-20260812T0122Z",
  "task_id": "dispatch-visual-seg-008-01",
  "asset_id": "visual-seg-008-01",
  "status": "SUCCESS",
  "generation_route": "gpt-image-2",
  "execution_route": "volcengine_general3_t2i_api",
  "asset_kind": "image",
  "role": "content_visual",
  "in_content_timeline": true,
  "prompt_sha256": "117ea5e80826a9b8ae481f3bd5af6a0d5c8babe9546f3ea5c4bd2d6a7c808387",
  "prompt_passthrough": true,
  "provider": "volcengine",
  "provider_model": "通用3.0-文生图",
  "provider_task_id": "4665301198117500117",
  "provider_request_id": "20260812111523CAAFCAE86F8EE1879F39",
  "provider_response_redacted": {
    "code": 10000,
    "message": "Success",
    "request_id": "20260812111523CAAFCAE86F8EE1879F39",
    "data": {
      "status": "done",
      "task_id": "4665301198117500117",
      "image_count": 1
    }
  },
  "local_path": "runs/real-moon-disappear-20260812T0122Z/video-production/execution/visual-seg-008-01/visual-seg-008-01.jpg",
  "sha256": "be887949b51617279247b70520e264036e20f3073dcaaf14e25914e9f41e8aee",
  "file_size_bytes": 173687,
  "width": 1024,
  "height": 1024,
  "max_concurrency_observed": 1,
  "control_returned_to_caller": true,
  "ambiguous_task_submission": false,
  "recovery_executor_reconstructed": true,
  "historical_executor_byte_identical": false
}
