{
  "schema_version": 1,
  "run_id": "real-moon-disappear-20260812T0122Z",
  "task_id": "dispatch-visual-seg-004-01",
  "asset_id": "visual-seg-004-01",
  "status": "SUCCESS",
  "generation_route": "gpt-image-2",
  "execution_route": "volcengine_general3_t2i_api",
  "asset_kind": "image",
  "role": "content_visual",
  "in_content_timeline": true,
  "prompt_sha256": "71e877b2b089e6913f23904971d9f3be502bb36a3a6dbc69580d6a8c1ccd1207",
  "prompt_passthrough": true,
  "provider": "volcengine",
  "provider_model": "通用3.0-文生图",
  "provider_task_id": "5571883617341419103",
  "provider_request_id": "20260812111438FB2CAD484B7E94F63262",
  "provider_response_redacted": {
    "code": 10000,
    "message": "Success",
    "request_id": "20260812111438FB2CAD484B7E94F63262",
    "data": {
      "status": "done",
      "task_id": "5571883617341419103",
      "image_count": 1
    }
  },
  "local_path": "runs/real-moon-disappear-20260812T0122Z/video-production/execution/visual-seg-004-01/visual-seg-004-01.jpg",
  "sha256": "f87ad476423b3b090e4b6f95e4a8f2961c8e868b4bd48b8705d1a8ba302829ba",
  "file_size_bytes": 155482,
  "width": 1024,
  "height": 1024,
  "max_concurrency_observed": 1,
  "control_returned_to_caller": true,
  "ambiguous_task_submission": false,
  "recovery_executor_reconstructed": true,
  "historical_executor_byte_identical": false
}
